Category,SubCategory,Title,Original Price,Discount Price,Discount,Seller Name,Number of Ratings,Positive Seller Ratings,Ship On Time,Chat Response Rate,Delivery Type,Cash On Delivery,Flagship Store
Electronic Accessories,https://www.daraz.com.bd/audio/,QKZ DM10 Zinc Alloy HiFi Earphone In Ear Earphone,625,299,52,Time Square,4208,85,0,79,Standard Delivery,Cash on Delivery Available,Yes
Electronic Accessories,https://www.daraz.com.bd/audio/,"Uiisii HM 12 Super Bass Stereo In-Ear Earphone with Pouch - Immerse in Audiophile Sound Quality On-The-Go, and Keep it Handy",520,229,56,Subaita Dreamland,579,82,0,98,Free Delivery,Cash on Delivery Available,No
Electronic Accessories,https://www.daraz.com.bd/audio/,Uiisii C100 Super Bass Stereo In Ear Headphone - Black,424,199,53,Time Square,2714,85,0,79,Standard Delivery,Cash on Delivery Available,Yes
Electronic Accessories,https://www.daraz.com.bd/audio/,Orignal Creative High Bass Audio Earphone with Pouch EP-530 - Black,299,125,58,Rimjhim Shop,627,81,0,92,Free Delivery,Cash on Delivery Available,No
Electronic Accessories,https://www.daraz.com.bd/audio/,Vivo In Year Yearphone is the best sound quality-white with free one - Emphasizing Value,270,99,63,Prima Store,374,84,0,96,Free Delivery,Cash on Delivery Available,No
Electronic Accessories,https://www.daraz.com.bd/audio/,DM10 QKZ DM10 Zinc Alloy HiFi In Ear Earphones QKZ DM10 3.5mm Wired In-Ear Earphone,690,205,70,G For Gadgets,1378,80,0,88,Free Delivery,Cash on Delivery Available,No
Electronic Accessories,https://www.daraz.com.bd/audio/,QKZ DM7 Zinc Alloy In Ear HiFi Earphone Stereo Bass Headset,1025,390,62,Time Square,1508,85,0,79,Standard Delivery,Cash on Delivery Available,Yes
Electronic Accessories,https://www.daraz.com.bd/audio/,QKZ DM10 Zinc Alloy HiFi Earphones,690,294,57,Gadgets Lab,5429,85,0,77,Free Delivery,Cash on Delivery Available,No
Electronic Accessories,https://www.daraz.com.bd/audio/,REMAX RM-510 High Performance Earphones REMAX RM 510 Wired Earphone Remax RM 510 Wired In-ear Stereo Music Headset with Mic wire control function,599,206,66,G For Gadgets,583,80,0,88,Free Delivery,Cash on Delivery Available,No
Electronic Accessories,https://www.daraz.com.bd/audio/,UIISII C100 In-ear Wired Heavy Bass Earphones with MIC - Ear Phone - Headphone,250,161,36,Trendy Tech,111,79,0,71,Standard Delivery,Cash on Delivery Available,Yes
Electronic Accessories,https://www.daraz.com.bd/audio/,High Quality Hd Eo-Ig955 Headset In-Ear Earphone - Headphone,150,69,54,Prince Fashon-BD,829,82,0,98,Free Delivery,Cash on Delivery Available,No
Electronic Accessories,https://www.daraz.com.bd/audio/,Wire Control Headset for Smartphone 3.5mm In-ear Wired Microphone Volume Control Headset Earphone - Headphone,280,95,66,Meghla Shop,227,84,0,95,Free Delivery,Cash on Delivery Available,No
Electronic Accessories,https://www.daraz.com.bd/audio/,oraimo OEP-E21P Halo Half-in-Ear Wired Earphones with Remote Control & Mic,339,214,37,ORAIMO,155,84,100,80,Free Delivery,Cash on Delivery Available,No
Electronic Accessories,https://www.daraz.com.bd/audio/,High Quality HD EO-IG955 Headset In-Ear Earphone,300,97,68,Smart Gadgets-BD,83,76,0,99,Free Delivery,Cash on Delivery Available,No
Electronic Accessories,https://www.daraz.com.bd/audio/,Remax Rm-510 High Performance Earphones - Headphone,500,184,63,GADGET corner,48,81,0,86,Free Delivery,Cash on Delivery Available,No
Electronic Accessories,https://www.daraz.com.bd/audio/,KZ EDX Pro Hi-Fi bass Dual Magnetic Dynamic Earbuds with Mic,1175,740,37,Time Square,286,85,0,79,Standard Delivery,Cash on Delivery Available,Yes
Electronic Accessories,https://www.daraz.com.bd/audio/,QKZ DM10 Zinc Alloy HiFi Earphone In Ear Earphones,700,181,74,GADGET corner,197,81,0,86,Free Delivery,Cash on Delivery Available,No
Electronic Accessories,https://www.daraz.com.bd/audio/,DM10 QKZ DM10 Zinc Alloy HiFi In Ear Earphones QKZ DM10 3.5mm Wired In-Ear Earphone- Dreamy DeaLs,600,166,72,Dreamy Deals,38,82,0,99,Standard Delivery,Cash on Delivery Available,No
Electronic Accessories,https://www.daraz.com.bd/audio/,Hbq I7S Double Dual Mini Wireless Earphone With Power Case - Headphone,1000,275,72,Better Buy (GAZ),385,85,0,99,Free Delivery,Cash on Delivery Available,No
Electronic Accessories,https://www.daraz.com.bd/audio/,REMAX RM-510 High Performance Earphone,700,180,74,Foyez shop,205,82,0,75,Standard Delivery,Cash on Delivery Available,No
Electronic Accessories,https://www.daraz.com.bd/audio/,OnePlus Nord Magnetic control 9.2mm drivers 3.5mm Wired Earphones - Black,1250,849,32,Motion View,191,90,0,96,Free Delivery,Cash on Delivery Available,Yes
Electronic Accessories,https://www.daraz.com.bd/audio/,UiiSii HM13 In-Ear Earphone with Headphone Pouch - Headphone,625,339,46,Time Square,3847,85,0,79,Standard Delivery,Cash on Delivery Available,Yes
Electronic Accessories,https://www.daraz.com.bd/audio/,M10 TWS Earphone 9D Stereo LED Digital Display Touch CVC8.0 Digital Noise Reduction Technology - Headphone - Headphone - Ear Phone - Earphone,999,385,61,Sneha Shop,25,75,0,32,Standard Delivery,Cash on Delivery Available,No
Electronic Accessories,https://www.daraz.com.bd/audio/,Exceptional Quality - Oraimo oep-e11 conch 2-stylish-deper-in-in-year-in-earphone-white - Reliable Accessory,250,211,16,ORAIMO,52,84,100,80,Free Delivery,Cash on Delivery Available,No
Electronic Accessories,https://www.daraz.com.bd/audio/,Akg Type C Super Bass Earphone With Pouch Headphone - Headphone,800,270,66,Mugdho Mega Shop,89,87,0,98,Standard Delivery,Cash on Delivery Available,No
Electronic Accessories,https://www.daraz.com.bd/audio/,Remax Rm 510 Wired High Performance Earphones - Headphone,675,290,57,Gadgets Lab,2548,85,0,77,Free Delivery,Cash on Delivery Available,No
Electronic Accessories,https://www.daraz.com.bd/audio/,Remax Earphone Rm 512 Earphone,399,99,75,Snehas Gadget,65,75,0,36,Standard Delivery,Cash on Delivery Available,No
Electronic Accessories,https://www.daraz.com.bd/audio/,Relme Buds Wired Earphones With Mic Buds Wired Earphones With Mic - Headphone,149,105,30,Rimjhim Shop,53,81,0,92,Free Delivery,Cash on Delivery Available,No
Electronic Accessories,https://www.daraz.com.bd/audio/,DM7 Zinc Alloy Hifi Super Bass In Ear Earphones - Black - Headphone - Headphone,920,368,60,Gadgets Lab,1139,85,0,77,Free Delivery,Cash on Delivery Available,No
Electronic Accessories,https://www.daraz.com.bd/audio/,Super Bass Wireless Bluetooth Earphone - Black,550,127,77,Better Buy (GAZ),160,85,0,99,Free Delivery,Cash on Delivery Available,No
Electronic Accessories,https://www.daraz.com.bd/audio/,"Earphones, Gm 008 Universal Wired Headphone With Microphone In-Ear For Gaming - Headphone - Headphone",650,265,59,BShop Computer,102,80,0,0,Free Delivery,Cash on Delivery Available,No
Electronic Accessories,https://www.daraz.com.bd/audio/,Super Headphone For All phones Wired Headset with Mic - White,250,73,71,Rimjhim Shop,143,81,0,92,Free Delivery,Cash on Delivery Available,No
Electronic Accessories,https://www.daraz.com.bd/audio/,DM10 Zinc Alloy HiFi In Ear Earphone QKZ DM10,450,193,57,city market bd,160,76,0,77,Free Delivery,Cash on Delivery Available,No
Electronic Accessories,https://www.daraz.com.bd/audio/,RIVO EP 103 In-Ear Magnetic Gaming Earphone with Extreme & Deep Bass,450,360,20,GADGET CORNER CHATTOGRAM (CTG),381,89,0,90,Free Delivery,Cash on Delivery Available,No
Electronic Accessories,https://www.daraz.com.bd/audio/,Universal UiiSii C100 Wired Headset & surround Sound,199,194,3,Sami Enterprise BD,2745,89,0,98,Free Delivery,Cash on Delivery Available,No
Electronic Accessories,https://www.daraz.com.bd/audio/,Buds Wired Earphones With Mic Buds Wired Earphones With Mic - Headphone,155,47,70,Rimjhim Shop,178,81,0,92,Free Delivery,Cash on Delivery Available,No
Electronic Accessories,https://www.daraz.com.bd/audio/,"KZ Wired Earphone Cable for KZ ZSX, ZSN Pro, ZS10 Pro - With MIC",975,274,72,Time Square,147,85,0,79,Standard Delivery,Cash on Delivery Available,Yes
Electronic Accessories,https://www.daraz.com.bd/audio/,Vivo In Ear Earphone Best Sound quality with free one - White,199,100,50,Prima Store,341,84,0,96,Free Delivery,Cash on Delivery Available,No
Electronic Accessories,https://www.daraz.com.bd/audio/,JBL TUNE 110 In Ear Earphone,1490,890,40,JBL Bangladesh,412,92,0,96,Free Delivery,Cash on Delivery Available,Yes
Electronic Accessories,https://www.daraz.com.bd/audio/,UiiSii HM12 Deep Bass Good Treble Earphones,360,186,48,Shabiha Enterprise BD,37,81,0,96,Free Delivery,Cash on Delivery Available,No
Electronic Accessories,https://www.daraz.com.bd/audio/,Cute Cartoon Rabbit Wired Earphone With Microphone For Girls - Headphone - Headphone,800,270,66,Villagie Store,458,88,0,97,Standard Delivery,Cash on Delivery Available,No
Electronic Accessories,https://www.daraz.com.bd/audio/,KZ HD9 Earphones HiFi Sport Earbuds Copper Earhook ear Headphones In Ear Earphone For Running With Microphone game Headset,925,279,70,Time Square,164,85,0,79,Standard Delivery,Cash on Delivery Available,Yes
Electronic Accessories,https://www.daraz.com.bd/audio/,Uiisii C100 Super Bass Stereo In Ear Headphone - Black,424,195,54,Time Square,56,85,0,79,Standard Delivery,Cash on Delivery Available,Yes
Electronic Accessories,https://www.daraz.com.bd/audio/,UiiSii C100 In-ear Earphone with MIC - Headphone - Ear Phone - Earphone,670,196,71,Gadgets Lab,1307,85,0,77,Free Delivery,Cash on Delivery Available,No
Electronic Accessories,https://www.daraz.com.bd/audio/,QKZ DM10 Zinc Alloy Metal Magnetic Earphone,720,314,56,Time Square,260,85,0,79,Standard Delivery,Cash on Delivery Available,Yes
Electronic Accessories,https://www.daraz.com.bd/audio/,DM9 QKZ DM9 Zinc Alloy HiFi Metal In Ear Earphones DM9 3.5mm Jack QKZ DM9 Zinc Alloy HiFi Metal In Ear Earphones - Headphone - Headphone - Ear Phone - Earphone - Headphone,500,274,45,Gadget's Frame BD,30,79,0,100,Standard Delivery,Cash on Delivery Available,No
Electronic Accessories,https://www.daraz.com.bd/audio/,RIVO EP 103 Earphone Deep Bass Eparphone Gaming Earphone [4 Months Warranty],599,365,39,ABIRSHOP BD,24,0,0,100,Free Delivery,Cash on Delivery Available,No
Electronic Accessories,https://www.daraz.com.bd/audio/,7 8 Plus X XR XS Max 12 12 pro max 13 13 pro max Wired Earphone With Microphone Gaming Headset Stereo,299,289,3,King OF Gadget,370,86,0,71,Free Delivery,Cash on Delivery Available,No
Electronic Accessories,https://www.daraz.com.bd/audio/,REMAX RM-711 WIRE CONTROLLED EARPLUG TYPE EARPHONE,675,308,54,Time Square,114,85,0,79,Standard Delivery,Cash on Delivery Available,Yes
Electronic Accessories,https://www.daraz.com.bd/audio/,UiiSii HM 13 In-Ear Earphone (With Pouch) - Headphone,550,400,27,City ShopHUB,0,0,0,100,Free Delivery,Cash on Delivery Available,No
Electronic Accessories,https://www.daraz.com.bd/audio/,"Super Bus Headphones Ear Hook - Secure and Comfortable Fit, Ideal for Sports and Active Lifestyles",300,122,59,SIKDER SHOP,1426,82,0,96,Free Delivery,Cash on Delivery Available,No
Electronic Accessories,https://www.daraz.com.bd/audio/,G20 Gaming Earphone Noise Reduction 3.5mm Gaming Headset with Microphone,1200,358,70,Gadgetology,437,88,0,98,Free Delivery,Cash on Delivery Available,No
Electronic Accessories,https://www.daraz.com.bd/audio/,REMAX RM 510 Wired Earphone High Performance Earphones,675,294,56,Time Square,1169,85,0,79,Standard Delivery,Cash on Delivery Available,Yes
Electronic Accessories,https://www.daraz.com.bd/audio/,Realme stereo earphones with mic,120,60,50,Kotha Enterprise Mart,15,0,0,100,Standard Delivery,Cash on Delivery Available,No
Electronic Accessories,https://www.daraz.com.bd/audio/,KIN K28 Earphone Buy 1 Get 1 Free Stylish Stereo In-Ear Headphone with Balanced sound quality - Headphone,400,167,58,Gadgets HUB BD,73,74,0,100,Free Delivery,Cash on Delivery Available,No
Electronic Accessories,https://www.daraz.com.bd/audio/,Remax - RM 510 In-Ear Earphone With Metal Box High Performance Touch Music Wired a Bass - heavy Stereo Sound,550,343,38,JTPC,625,85,0,98,Free Delivery,Cash on Delivery Available,No
Electronic Accessories,https://www.daraz.com.bd/audio/,Earphone Wired Earphone Cartoon Earphone Cute Rabbit Wired Headset Portable Cute Student Earphone Love Series,700,330,53,Afia Eshop BD,74,84,0,99,Free Delivery,Cash on Delivery Available,No
Electronic Accessories,https://www.daraz.com.bd/audio/,QKZ DM10 Zinc Alloy Metal Earphone - Headphone,450,165,63,Somiron Electronics,7,75,0,98,Standard Delivery,Cash on Delivery Available,No
Electronic Accessories,https://www.daraz.com.bd/audio/,Wiresto In-Ear Headphones Earphone Wired Earbuds Sport In Ear Headphone Stereo Headset Alloy Half In Ear Subwoofer Wired Headset 3.5mm Jack Wired Cable Music Headphone HIFI Sound Quality Headphone,493,419,15,Wiresto,204,87,100,100,Free Delivery,Cash on Delivery Available,No
Electronic Accessories,https://www.daraz.com.bd/audio/,TRN MT1 1DD Dynamic Drivers In-Ear Monitors HIFI Bass-Running Sport-Noise Cancelling Earphone,1000,625,38,Trendy Buy,131,91,0,100,Standard Delivery,Cash on Delivery Available,No
Electronic Accessories,https://www.daraz.com.bd/audio/,Geeoo X10 In-Ear Earphone with Microphone in Black - Enjoy Crisp and Clear Audio with These Earphones,179,169,6,GREEN ELECTRONICS.,57,84,0,58,Free Delivery,Cash on Delivery Available,No
Electronic Accessories,https://www.daraz.com.bd/audio/,VIVO In Ear Earphone Best Bass Sound Quality For All Android - White Color,100,48,52,UNIQ BD,51,80,0,0,Standard Delivery,Cash on Delivery Available,No
Electronic Accessories,https://www.daraz.com.bd/audio/,Uiisii Hm 12 Super Bass Stereo And Dynamic In-Ear Headphones With Pouch - Headphone,470,225,52,Mamur Beta Mart,152,86,0,100,Free Delivery,Cash on Delivery Available,No
Electronic Accessories,https://www.daraz.com.bd/audio/,Button mobile orginal Earphone without Receiver,100,24,76,Talha Telecom and Electric,5,0,0,92,Free Delivery,Cash on Delivery Available,No
Electronic Accessories,https://www.daraz.com.bd/audio/,Twin Horn Gaming Earphone Super Bass Stereo Headset With 3.5Mm Plug - Headphone - Ear Phone - Headphone - Headphone - Headphone,450,131,71,Gadgetlife,83,86,0,97,Free Delivery,Cash on Delivery Available,No
Electronic Accessories,https://www.daraz.com.bd/audio/,Orignal Creative High Bass Audio Earphone With Pouch Ep-530 - Black - Ear Phone - Headphone - Headphone - Headphone - Headphone,550,145,74,SM Happy Shopping,174,83,0,82,Free Delivery,Cash on Delivery Available,No
Electronic Accessories,https://www.daraz.com.bd/audio/,Dynamic Universal High-quality Sensitive 3.5mm Stereo In-ear Earbud Wired Earphone,650,269,59,Gadget dream,236,84,0,68,Standard Delivery,Cash on Delivery Available,No
Electronic Accessories,https://www.daraz.com.bd/audio/,UiiSii C100 In Ear Wired Earphones,425,205,52,Time Square,34,85,0,79,Standard Delivery,Cash on Delivery Available,Yes
Electronic Accessories,https://www.daraz.com.bd/audio/,Qkz Dm7 Zinc Alloy In Ear Hifi Wired Earphone Stereo Bass - Black,900,435,52,JTPC,1244,85,0,98,Free Delivery,Cash on Delivery Available,No
Electronic Accessories,https://www.daraz.com.bd/audio/,Piston In-Ear Earphone For MI and all types of smartphones,149,91,39,KMA,29,94,0,100,Free Delivery,Cash on Delivery Available,No
Electronic Accessories,https://www.daraz.com.bd/audio/,Remax RM 510 In-Ear Earphone / Headphones With Mic,350,170,51,Fair Gadget,17,0,0,96,Free Delivery,Cash on Delivery Available,No
Electronic Accessories,https://www.daraz.com.bd/audio/,Lenovo HE05 Bluetooth 5.0 In-Ear Magnetic Neckband Earphone,340,340,0,Chittagong Gadget House,36,90,0,88,Standard Delivery,Cash on Delivery Available,No
Electronic Accessories,https://www.daraz.com.bd/audio/,Realme Stereo Earphone High Definition Sound Quality - Headphone,120,39,68,RIAD ENTERPRISE GADGETS,3,0,0,81,Free Delivery,Cash on Delivery Available,No
Electronic Accessories,https://www.daraz.com.bd/audio/,REMAX RM 510 In-Ear Earphone With Metal box,410,330,20,Aim Technology,507,89,0,99,Free Delivery,Cash on Delivery Available,Yes
Electronic Accessories,https://www.daraz.com.bd/audio/,Remax Rm-711 ওয়্যার কন্ট্রোলড ইয়ারপ্লাগ টাইপ ইয়ারফোন(Null) - Headphone,350,203,42,GADGET CORNER CHATTOGRAM (CTG),58,89,0,90,Free Delivery,Cash on Delivery Available,No
Electronic Accessories,https://www.daraz.com.bd/audio/,Remax Earphone Rm 512 EarPhone,525,231,56,Time Square,607,85,0,79,Standard Delivery,Cash on Delivery Available,Yes
Electronic Accessories,https://www.daraz.com.bd/audio/,KZ EDX PRO Dual Dynamic Drive Detachable Cable IEM In-Earphone,1200,711,41,Trendy Tech,164,79,0,71,Standard Delivery,Cash on Delivery Available,Yes
Electronic Accessories,https://www.daraz.com.bd/audio/,head phone ber phone,100,74,26,Sadia Telecom (BAG),7,88,0,0,Standard Delivery,Cash on Delivery Available,No
Electronic Accessories,https://www.daraz.com.bd/audio/,Uii Sii HM 13 Wired Noise Cancelling Heavy Bass Music In-Ear with Mic Earphone for All Smartphone,589,190,68,G For Gadgets,72,80,0,88,Free Delivery,Cash on Delivery Available,No
Electronic Accessories,https://www.daraz.com.bd/audio/,CK8 Dual Driver Audifonos Stereo Bass Sport Earphones - Black - Headphone - Headphone,550,255,54,Gadgets Lab,1092,85,0,77,Free Delivery,Cash on Delivery Available,No
Electronic Accessories,https://www.daraz.com.bd/audio/,GM-008 Gaming Headset PUBG Stereo Earphone - Immerse Yourself in Your Favorite Games with Precision Audio,560,256,54,Trovella BD,100,82,0,51,Free Delivery,Cash on Delivery Available,No
Electronic Accessories,https://www.daraz.com.bd/audio/,High-Performance - UiiSii HM13 In-Ear Dynamic Heavy Bass Metal Earphone with Microphone - Reliable Accessory,475,357,25,Trendy Buy,150,91,0,100,Standard Delivery,Cash on Delivery Available,No
Electronic Accessories,https://www.daraz.com.bd/audio/,Samsung Earphone 3.5 mm Wired Earphone with Mic White Color Headphone,250,119,52,GuluGulu Kids,21,89,0,100,Free Delivery,Cash on Delivery Available,No
Electronic Accessories,https://www.daraz.com.bd/audio/,Uiisii Hm9C Type C In-Ear Wired Earphone - Headphone - Ear Phone - Earphone,1100,578,47,SRT Mart,28,93,0,99,Standard Delivery,Cash on Delivery Available,No
Electronic Accessories,https://www.daraz.com.bd/audio/,KZ EDX PRO Dual Dynamic Drive Detachable Cable IEM In-Ear Earphone,1150,770,33,JTPC,191,85,0,98,Free Delivery,Cash on Delivery Available,No
Electronic Accessories,https://www.daraz.com.bd/audio/,Mango VMEX LF-05 Headphone Heavy Bass 3.5Mm Port 1.2M Wired Earphone,480,255,47,MANGO Electronics,38,85,0,99,Free Delivery,Cash on Delivery Available,Yes
Electronic Accessories,https://www.daraz.com.bd/audio/,"Tws wireless inpods i12 ,Buds air i12 Bluetooth.",265,265,0,GADGET Wholesale,16,0,0,0,Free Delivery,Cash on Delivery Available,No
Electronic Accessories,https://www.daraz.com.bd/audio/,Lenovo HE05X (Black Box Official) Bluetooth 5.0 IPX5 Waterproof Neckband Wireless Earphone,1000,237,76,Best Gadget Mall,6,71,0,97,Standard Delivery,Cash on Delivery Available,No
Electronic Accessories,https://www.daraz.com.bd/audio/,Premium Quality - UiiSii HM13 In-Ear Dynamic Earphone With Pouch - Headphone - Emphasizing Value - Simple to Use,699,230,67,Shenzhen Digital City,29,79,0,100,Free Delivery,Cash on Delivery Available,No
Electronic Accessories,https://www.daraz.com.bd/audio/,UiiSii HM 12 Super Bass Stereo In Ear-phone,520,225,57,ChinaTown 1640607917,211,86,0,71,Free Delivery,Cash on Delivery Available,No
Electronic Accessories,https://www.daraz.com.bd/audio/,Junerose Jr-I4S In-Ear Earphones With Box By M.B Telicom - Headphone,290,116,60,m.b telicom 1581312419,435,87,0,100,Free Delivery,Cash on Delivery Available,No
Electronic Accessories,https://www.daraz.com.bd/audio/,Earphone One_Plus With Mic Deep Bass for all Android Smartphone,150,75,50,AR-ROHMAN BD,11,0,0,97,Standard Delivery,Cash on Delivery Available,No
Electronic Accessories,https://www.daraz.com.bd/audio/,Realme stereo earphone Buy 1 Get 1 Free,320,80,75,Kabir's World,67,78,0,69,Free Delivery,Cash on Delivery Available,No
Electronic Accessories,https://www.daraz.com.bd/audio/,Original iPhone X Earphone,500,228,54,Fair Gadget,11,0,0,96,Free Delivery,Cash on Delivery Available,No
Electronic Accessories,https://www.daraz.com.bd/audio/,Buds2 Wired Earphones with Mic Buds Wired Earphones,120,49,59,Happy Rimjhim Shop,37,83,0,63,Free Delivery,Cash on Delivery Available,No
Electronic Accessories,https://www.daraz.com.bd/audio/,In-Ear Headphone Earphone with Mic. for all Mobile & most all Device,200,80,60,Beauty Soap,19,78,0,75,Free Delivery,Cash on Delivery Available,No
Electronic Accessories,https://www.daraz.com.bd/audio/,TRN MT1 10MM Dual Magnet Dynamic Driver Professional Grade In-Ear Monitor Earphone,850,650,24,AJ TELECOM,22,88,0,98,Free Delivery,Cash on Delivery Available,No
Electronic Accessories,https://www.daraz.com.bd/audio/,Realme buds 2 Wired Earbud In-ear mi Bass Subwoofer Stereo Earphones Hands-free 3.5mm,90,40,56,SMcollection,5,81,0,96,Standard Delivery,Cash on Delivery Available,No
Electronic Accessories,https://www.daraz.com.bd/audio/,"Qkz DM 10 Zinc Alloy Hifi Earphones Gaming High Stereo Bus Sound In Ear Earphones,magnetic earphones - Headphone Black",530,227,57,Unique Digital Shop,31,77,0,92,Standard Delivery,Cash on Delivery Available,No
Electronic Accessories,https://www.daraz.com.bd/audio/,UiiSii HM 12 Super Bass Stereo In-Ear Headphone - Enjoy Dynamic Audio with These High-Quality Earphones - Perfect for Music Enthusiasts,470,228,51,Shenzhen Digital City,259,79,0,100,Free Delivery,Cash on Delivery Available,No
Electronic Accessories,https://www.daraz.com.bd/audio/,Samsung Earphone 3.5 mm Original Wired Earphone with Mic White Color,250,115,54,sharabangla,15,88,0,97,Free Delivery,Cash on Delivery Available,No
Electronic Accessories,https://www.daraz.com.bd/audio/,TYPE C Super Bass Earphone With Pouch Headphone,1000,270,73,Gadget Division,10,89,0,100,Standard Delivery,Cash on Delivery Available,No
Electronic Accessories,https://www.daraz.com.bd/audio/,QKZ DM10 Zinc Alloy 3.5mm HiFi Earphone In Ear Earphone,500,278,44,Trendio,58,76,0,95,Free Delivery,Cash on Delivery Available,Yes
Electronic Accessories,https://www.daraz.com.bd/audio/,Uiisii C100 Super Bass Stereo In Ear Headphone - Black,299,192,36,Trendy Tech,13,79,0,71,Standard Delivery,Cash on Delivery Available,Yes
Electronic Accessories,https://www.daraz.com.bd/audio/,"Apple Lightning earbuds/in ear wired earphones for i phone, i pad and all the apple products",1550,880,43,Mega Accessories,17,70,0,93,Standard Delivery,Cash on Delivery Available,No
Electronic Accessories,https://www.daraz.com.bd/audio/,UiiSii HM12 Deep Bass Good Treble Earphones,350,184,47,AST,352,80,0,95,Standard Delivery,Cash on Delivery Available,No
Electronic Accessories,https://www.daraz.com.bd/audio/,Remax RM 711 Earphone 3.5mm Wired Noise Cancelling Fashion in-Ear Earphone Frequency Response Range:20-20000Hz,390,250,36,Tech Plus,24,90,0,99,Free Delivery,Cash on Delivery Available,Yes
Electronic Accessories,https://www.daraz.com.bd/audio/,Xiaomi Mi Dual Driver Metal Magnetic In-Ear Earphone- Blue - Headphone - Ear Phone,850,633,26,GADGET CORNER CHATTOGRAM (CTG),79,89,0,90,Free Delivery,Cash on Delivery Available,No
Electronic Accessories,https://www.daraz.com.bd/audio/,amplifier module and Car Amplifier Bluetooth MP3 Decoding Board Module FM Radio USB TF AUX Remote Control,150,139,7,Al-amin cloth center (Al-amin online),17,84,0,92,Free Delivery,Cash on Delivery Available,No
Electronic Accessories,https://www.daraz.com.bd/audio/,TRN MT1 Pro Hi-FI 1DD Dynamic In-ear Earphone Drive HIFI Bass Metal Monitor Running Sport Earphone - Headphone - Headphone,1550,846,45,Gadget Master RP,72,90,0,100,Standard Delivery,Cash on Delivery Available,No
Electronic Accessories,https://www.daraz.com.bd/audio/,"UGREEN USB C Earbuds, Wired Headphones with Microphone and Volume Control Noise Cancelling Headphones, HiFi Stereo Wired Earbuds Compatible with 2021 iPad Pro Samsung Galaxy S21 Google Pixel 5/4/4XL",2699,1330,51,Ugreen,85,94,100,100,Free Delivery,Cash on Delivery Available,No
Electronic Accessories,https://www.daraz.com.bd/audio/,High quality hd EO-IG955 headset in-ear earphones,200,97,52,Party Gallery,13,70,0,100,Standard Delivery,Cash on Delivery Available,No
Electronic Accessories,https://www.daraz.com.bd/audio/,Xiaomi Dual Driver YDSDQ01WM In-Ear Earphones,1025,650,37,Time Square,90,85,0,79,Standard Delivery,Cash on Delivery Available,Yes
Electronic Accessories,https://www.daraz.com.bd/audio/,"For Vivo Buy 1 Get 1 Free, In Ear Earphone Deep Sound quality for any Android, Buy One Get One Free",290,105,64,Anaya's Collection (GAZ),30,86,0,95,Standard Delivery,Cash on Delivery Available,No
Electronic Accessories,https://www.daraz.com.bd/audio/,Baseus Encok C17 Type-C In-Ear Earphone - Headphone,750,568,24,KZ Gadget,47,89,0,99,Free Delivery,Cash on Delivery Available,No
Electronic Accessories,https://www.daraz.com.bd/audio/,Type C Earphone Original Samsung Wired Earphone with Mic White Color Headphone,499,219,56,Shenzhen Digital City,43,79,0,100,Free Delivery,Cash on Delivery Available,No
Electronic Accessories,https://www.daraz.com.bd/audio/,Realme Buds 2 Wired Earphone Hands-Free 3.5mm - Black Headphone buy 1 gat 1 free - Ear Phone,200,89,56,real tech bd.,471,83,0,91,Free Delivery,Cash on Delivery Available,No
Electronic Accessories,https://www.daraz.com.bd/audio/,QKZ DM10 Type C Zinc Alloy Metal Earphone: Enjoy Premium Sound Quality with Durability in QKZ DM10 Type C Zinc Alloy Metal Earphones.,450,362,20,AJ TELECOM,106,88,0,98,Free Delivery,Cash on Delivery Available,No
Electronic Accessories,https://www.daraz.com.bd/audio/,QKZ DM7 Zinc Alloy Hifi Super Bass In Ear Earphones - Black - Headphone,795,399,50,Trendy Tech,167,79,0,71,Standard Delivery,Cash on Delivery Available,Yes
