Category,SubCategory,Title,Original Price,Discount Price,Discount,Seller Name,Number of Ratings,Positive Seller Ratings,Ship On Time,Chat Response Rate,Delivery Type,Cash On Delivery,Flagship Store
Women's & Girls' Fashion,https://www.daraz.com.bd/womens-bags/?&price=699-&service=OS&from=filter,Elegant Mart Fashionable and Casual Oil Wax PU Leather Shoulder Crossbody Bag for Women,1200,899,25,ELEGANT MART LIMITED,16,78,0,97,Free Delivery,Cash on Delivery Available,Yes
Women's & Girls' Fashion,https://www.daraz.com.bd/womens-bags/?&price=699-&service=OS&from=filter,LouisWill Bag Soft PU Bucket Bags Prints Shoulder Bags Fashion Handbags,1934,1270,34,LouisWill,36,91,100,99,Free Delivery,Cash on Delivery Available,No
Women's & Girls' Fashion,https://www.daraz.com.bd/womens-bags/?&price=699-&service=OS&from=filter,Elegant mart tote side bag large Capacity American Stripe Women Ladies Weekend Canvas Luggage Tote Shoulder Travel chain Bag,1000,768,23,ELEGANT MART LIMITED,4,78,0,97,Free Delivery,Cash on Delivery Available,Yes
Women's & Girls' Fashion,https://www.daraz.com.bd/womens-bags/?&price=699-&service=OS&from=filter,Sunnyheart Teen Girls Backpack Adjustable Shoulder Straps Portable Multi Pockets Backpack School Bag,2361,1331,44,Sunnyheart,7,82,100,100,Free Delivery,Cash on Delivery Available,No
Women's & Girls' Fashion,https://www.daraz.com.bd/womens-bags/?&price=699-&service=OS&from=filter,Sunnyheart Women Shoulder Bag Faux Leather Ladies Single Shoulder Bag For Women,2838,1492,47,Sunnyheart,10,82,100,100,Free Delivery,Cash on Delivery Available,No
Women's & Girls' Fashion,https://www.daraz.com.bd/womens-bags/?&price=699-&service=OS&from=filter,LouisWill Fashion Women Bucket Bag Straw Bags Woven Shoulder Bag Handbag Crossbody Bag Leisure Style Suitable for Casual Summer,1364,840,38,LouisWill,99,91,100,99,Free Delivery,Cash on Delivery Available,No
Women's & Girls' Fashion,https://www.daraz.com.bd/womens-bags/?&price=699-&service=OS&from=filter,LouisWill Shoulder Bags Women Cross Body Bags Fashion Tote Bags Sling Bag Thick Canvas Stripe Bags Classic Schoolbags Travel Shopping Bag for Women Girls,1334,870,35,LouisWill,138,91,100,99,Free Delivery,Cash on Delivery Available,No
Women's & Girls' Fashion,https://www.daraz.com.bd/womens-bags/?&price=699-&service=OS&from=filter,Printed Cross Body & Shoulder Handbag - MKPT01 (Pink),1890,790,58,ETCT,2,88,0,99,Free Delivery,Cash on Delivery Available,Yes
Women's & Girls' Fashion,https://www.daraz.com.bd/womens-bags/?&price=699-&service=OS&from=filter,LouisWill Fashion Shoulder Bags For Women,1694,1070,37,LouisWill,266,91,100,99,Free Delivery,Cash on Delivery Available,No
Women's & Girls' Fashion,https://www.daraz.com.bd/womens-bags/?&price=699-&service=OS&from=filter,LouisWill Tote Bag Women Crossbody Bag Canvas Bag Multi-compartment Bag Hand Bag Large-capacity Messenger Bag Casual Shoulder Bag Fashion Sling Bag with Adjustable Shoulder Strap,2384,1530,36,LouisWill,21,91,100,99,Free Delivery,Cash on Delivery Available,No
Women's & Girls' Fashion,https://www.daraz.com.bd/womens-bags/?&price=699-&service=OS&from=filter,David Jones Paris women tote bag pu leather female crossbody bag large lady handbag,5150,1800,65,David Jones,10,93,100,97,Standard Delivery,Cash on Delivery Available,No
Women's & Girls' Fashion,https://www.daraz.com.bd/womens-bags/?&price=699-&service=OS&from=filter,ELEGANT MART Women fashion tote sidebag Shoulder oven Large Capacity Shoulder Bags Women Casual Straw Woven Handbags Fashion Bow Silk Scraf Decoration Tote Bags - Tote Bag,1050,810,23,ELEGANT MART LIMITED,7,78,0,97,Free Delivery,Cash on Delivery Available,Yes
Women's & Girls' Fashion,https://www.daraz.com.bd/womens-bags/?&price=699-&service=OS&from=filter,IELGY Simple And Exquisite Letter Texture Commuter Fashion Portable All-match Messenger Tote Bag Women,2460,2460,0,IELGY FBD,8,83,0,81,Standard Delivery,Cash on Delivery Available,No
Women's & Girls' Fashion,https://www.daraz.com.bd/womens-bags/?&price=699-&service=OS&from=filter,MATEYOYO Women Shoulder Bag Large Capacity Tote Bag Commuter Canvas Cross Body Bag Fashion Quality Canvas Burlap Tote Canvas Soft Cotton Handle Reusable Shopping Grocery Bag,2639,1440,45,MATEYOYO,156,92,100,100,Free Delivery,Cash on Delivery Available,No
Women's & Girls' Fashion,https://www.daraz.com.bd/womens-bags/?&price=699-&service=OS&from=filter,LouisWill Women Bag Ladies Fashion Crossbody Bag Soft PU Shoulder Bag Tote Bag Handbag Waterproof Sling Bag Large Capacity Mother's Bag Underarm Bag Bucket Bag,1919,1190,38,LouisWill,20,91,100,99,Free Delivery,Cash on Delivery Available,No
Women's & Girls' Fashion,https://www.daraz.com.bd/womens-bags/?&price=699-&service=OS&from=filter,【ZIME】Vintage ter Printing Clutch Bag For Women PU Leather Shoulder Bags Ladies Purses And Handbags Designer YB7,1597,896,44,ZIME,21,77,100,95,Free Delivery,Cash on Delivery Available,No
Women's & Girls' Fashion,https://www.daraz.com.bd/womens-bags/?&price=699-&service=OS&from=filter,Bili Online Ladies hand bag/Saddle Bag - Bag,1200,900,25,Bili Online,87,90,0,88,Free Delivery,Cash on Delivery Available,Yes
Women's & Girls' Fashion,https://www.daraz.com.bd/womens-bags/?&price=699-&service=OS&from=filter,IELGY Nylon Large Capacity Outdoor Backpack For Men And Women,2300,1136,51,IELGY FBD,5,83,0,81,Standard Delivery,Cash on Delivery Available,No
Women's & Girls' Fashion,https://www.daraz.com.bd/womens-bags/?&price=699-&service=OS&from=filter,LouisWill Women Bucket Bag With Small Elephant Pendant Large Capacity Bag Retro PU Bag Messenger Bag Single Shoulder Bag Simple Cross-body Bags For Going Out Working Travelling,1949,1220,37,LouisWill,9,91,100,99,Free Delivery,Cash on Delivery Available,No
Women's & Girls' Fashion,https://www.daraz.com.bd/womens-bags/?&price=699-&service=OS&from=filter,LouisWill Women Shoulder Bags Long Clutches Cross Body Bags Korean Style Ladies Phone Pouch Casual Crossbody Mobile Phone Wallets Mini Fashion Shoulder Bag Water Resistant Sling Bag,1754,1100,37,LouisWill,52,91,100,99,Free Delivery,Cash on Delivery Available,No
Women's & Girls' Fashion,https://www.daraz.com.bd/womens-bags/?&price=699-&service=OS&from=filter,LouisWill Women's Shoulder Bags Hand Bag Litchi Grain PU Portable Hand Bag Small Tote Bag Single Shoulder Bag Diagonal Cross Large CapacityLetter Bagfor Women Ladies,1724,1140,34,LouisWill,59,91,100,99,Free Delivery,Cash on Delivery Available,No
Women's & Girls' Fashion,https://www.daraz.com.bd/womens-bags/?&price=699-&service=OS&from=filter,MATEYOYO Fashion Women Shoulder Bag Drawstring Travel Bags Cross body Bag Leisure Style Suitable for Casual Summer Hand Bag/Beach Bag/Canvas Bag,2619,1450,45,MATEYOYO,146,92,100,100,Free Delivery,Cash on Delivery Available,No
Women's & Girls' Fashion,https://www.daraz.com.bd/womens-bags/?&price=699-&service=OS&from=filter,Crossbody Bag-Ladies Side Bag-Bili Ladies Bag-Bili Online Fashion Fury Ladies Crossbody Bag - Bag,1500,700,53,Bili Online,49,90,0,88,Free Delivery,Cash on Delivery Available,Yes
Women's & Girls' Fashion,https://www.daraz.com.bd/womens-bags/?&price=699-&service=OS&from=filter,Mateyoyo Women's Wallet - Multifunctional Clutch with Zipper Pocket,1549,750,52,MATEYOYO,126,92,100,100,Free Delivery,Cash on Delivery Available,No
Women's & Girls' Fashion,https://www.daraz.com.bd/womens-bags/?&price=699-&service=OS&from=filter,LouisWill Women's Bag Crocodile Pattern Soft Leather Bag Multi-layer Bag Large Capacity Diagonal Portable Mother's Bag Fashion Shoulder Bag PU Leather Texture Bucket Bag Cross Body Bag,2084,1350,35,LouisWill,15,91,100,99,Free Delivery,Cash on Delivery Available,No
Women's & Girls' Fashion,https://www.daraz.com.bd/womens-bags/?&price=699-&service=OS&from=filter,IELGY women's fashion black rhombus messenger mobile phone bag,1530,1060,31,IELGY,0,84,100,100,Free Delivery,Cash on Delivery Available,No
Women's & Girls' Fashion,https://www.daraz.com.bd/womens-bags/?&price=699-&service=OS&from=filter,LouisWill Bag for Women School Bag for Girls Travel Bag Laptop Bag Casual Backpack College Bag for Girls,2444,1570,36,LouisWill,16,91,100,99,Free Delivery,Cash on Delivery Available,No
Women's & Girls' Fashion,https://www.daraz.com.bd/womens-bags/?&price=699-&service=OS&from=filter,MATEYOYO Women Shoulder Bag Fashionable Shoulder Bag Ladies Sling Handbag Elegant Cross Bag Premium PU Leather Bag Travel Outing Sling Bag Casual Bags Trend Retro Sling Bag,3689,2170,41,MATEYOYO,2,92,100,100,Free Delivery,Cash on Delivery Available,No
Women's & Girls' Fashion,https://www.daraz.com.bd/womens-bags/?&price=699-&service=OS&from=filter,MATEYOYO Women Shoulder Bag Retro Bags Fashion Cross Body Bag Large Capacity Crossbody Bag Casual Messenger Bags Magnetic Buckle Bag Trend Retro Sling Bag,2899,1150,60,MATEYOYO,159,92,100,100,Free Delivery,Cash on Delivery Available,No
Women's & Girls' Fashion,https://www.daraz.com.bd/womens-bags/?&price=699-&service=OS&from=filter,Louiswill Waterproof Travel Bags for Both Men And Women,2849,1750,39,LouisWill,416,91,100,99,Free Delivery,Cash on Delivery Available,No
Women's & Girls' Fashion,https://www.daraz.com.bd/womens-bags/?&price=699-&service=OS&from=filter,LouisWill PU Handheld Versatile Casual One Shoulder Pillow Bag for Women,1874,1190,36,LouisWill,4,91,100,99,Free Delivery,Cash on Delivery Available,No
Women's & Girls' Fashion,https://www.daraz.com.bd/womens-bags/?&price=699-&service=OS&from=filter,Travel Bag Waterproof Weekender Bags Oxford Cloth Luggages Handbag Shoulder Dry and Wet Separation Sport Bag Fitness Bag Gym Totes for Men 0r Women medium size ( maroon / navy / Black),1090,871,20,MY SHOPEE BD,7,86,0,99,Free Delivery,Cash on Delivery Available,Yes
Women's & Girls' Fashion,https://www.daraz.com.bd/womens-bags/?&price=699-&service=OS&from=filter,David Jones Paris women bucket bag pu leather female crossbody bag large plain lady shoulder bag,6010,3260,46,David Jones,21,93,100,97,Standard Delivery,Cash on Delivery Available,No
Women's & Girls' Fashion,https://www.daraz.com.bd/womens-bags/?&price=699-&service=OS&from=filter,IELGY Women's Harajuku Style Cute Casual Large Capacity Backpack,2150,1014,53,IELGY FBD,10,83,0,81,Standard Delivery,Cash on Delivery Available,No
Women's & Girls' Fashion,https://www.daraz.com.bd/womens-bags/?&price=699-&service=OS&from=filter,David Jones Paris sling bag for women leather crossbody bag messenger bags ladies shoulder bag woman handbag 2022,6010,2060,66,David Jones,10,93,100,97,Standard Delivery,Cash on Delivery Available,No
Women's & Girls' Fashion,https://www.daraz.com.bd/womens-bags/?&price=699-&service=OS&from=filter,LouisWill Single Shoulder Bag Crossbody Bag PU Work Bag Leisure Student Bag Large Capacity Bag Messenger Bag Fashion Shoulder Bag Cross Body Bag Sling Bag For Students In Class,2414,1530,37,LouisWill,6,91,100,99,Free Delivery,Cash on Delivery Available,No
Women's & Girls' Fashion,https://www.daraz.com.bd/womens-bags/?&price=699-&service=OS&from=filter,LouisWill Women Shoulder Bag Soft PU Handbag Retro Cross Body Bag Large Capacity Crossbody Bag Casual Messenger Bags Magnetic Buckle Bag Trend Retro Sling Bag For Women Ladies Female,2894,1850,36,LouisWill,28,91,100,99,Free Delivery,Cash on Delivery Available,No
Women's & Girls' Fashion,https://www.daraz.com.bd/womens-bags/?&price=699-&service=OS&from=filter,MATEYOYO Women Handbag Korean Sling Bag Ins Fashion Shoulder Bag Dual Use Leisure Style Casual Summer Hand Bag Messenger Bag Women Beach Bag Oxford Bag,2819,1660,41,MATEYOYO,4,92,100,100,Free Delivery,Cash on Delivery Available,No
Women's & Girls' Fashion,https://www.daraz.com.bd/womens-bags/?&price=699-&service=OS&from=filter,MATEYOYO Women Backpack Korean School Backpacks Fashionable Ladies Backpack Casual Simple Student Bags Laptop Backpacks Lightweight Anti-theft Backpacks,3149,1860,41,MATEYOYO,1,92,100,100,Free Delivery,Cash on Delivery Available,No
Women's & Girls' Fashion,https://www.daraz.com.bd/womens-bags/?&price=699-&service=OS&from=filter,IELGY women's korean style cute design backpack,2750,1820,34,IELGY,22,84,100,100,Free Delivery,Cash on Delivery Available,No
Women's & Girls' Fashion,https://www.daraz.com.bd/womens-bags/?&price=699-&service=OS&from=filter,LouisWill Backpack Women Shoulder Bag Waterproof Oxford Cloth Backpack Large Capacity Backpack Lightweight Laptop Backpack Casual Zipper Packs With Fur Ball Decoration for Girls Teens Women,2399,1570,35,LouisWill,1,91,100,99,Free Delivery,Cash on Delivery Available,No
Women's & Girls' Fashion,https://www.daraz.com.bd/womens-bags/?&price=699-&service=OS&from=filter,ELEGANT MART Women Oxford Nylon Shoulder Bags Luxury Casual Handbag Ladies Large Shopping Tote Beach Bags,1000,798,20,ELEGANT MART LIMITED,6,78,0,97,Free Delivery,Cash on Delivery Available,Yes
Women's & Girls' Fashion,https://www.daraz.com.bd/womens-bags/?&price=699-&service=OS&from=filter,David Jones Paris Men's wallet pu leather small Coin purse,2000,790,60,David Jones,2,93,100,97,Standard Delivery,Cash on Delivery Available,No
Women's & Girls' Fashion,https://www.daraz.com.bd/womens-bags/?&price=699-&service=OS&from=filter,IELGY Women's small bag new ins versatile broadband shoulder messenger bag fashion texture bucket bag,2430,1690,30,IELGY,6,84,100,100,Free Delivery,Cash on Delivery Available,No
Women's & Girls' Fashion,https://www.daraz.com.bd/womens-bags/?&price=699-&service=OS&from=filter,MATEYOYO Women Shoulder Bag Soft PU Bags Simple Fashion Cross Body Bag Large Capacity Crossbody Bag Casual Bags Trend Retro Sling Bag,2789,1240,56,MATEYOYO,7,92,100,100,Free Delivery,Cash on Delivery Available,No
Women's & Girls' Fashion,https://www.daraz.com.bd/womens-bags/?&price=699-&service=OS&from=filter,Printed Cross Body & Shoulder Handbag - MKPT01 (Off White),1890,790,58,ETCT,2,88,0,99,Free Delivery,Cash on Delivery Available,Yes
Women's & Girls' Fashion,https://www.daraz.com.bd/womens-bags/?&price=699-&service=OS&from=filter,Zip It Good Stripe Handbag/Party Bag for Girls/Casual Handbag,2150,1380,36,Zip It Good,1,84,0,69,Free Delivery,Cash on Delivery Available,Yes
Women's & Girls' Fashion,https://www.daraz.com.bd/womens-bags/?&price=699-&service=OS&from=filter,ELEGANT MART College Students Alphabet Embroidery Canvas Large Capacity Single Shoulder Crossbody tote bag for girls,1600,1120,30,ELEGANT MART LIMITED,1,78,0,97,Free Delivery,Cash on Delivery Available,Yes
Women's & Girls' Fashion,https://www.daraz.com.bd/womens-bags/?&price=699-&service=OS&from=filter,LouisWill Women Cross Body Bags Shoulder Bags Korean Style Ladies Phone Pouch Casual Crossbody Mobile Phone Bag Fashion Shoulder Bag Water Resistant Sling Bag,2859,1670,42,LouisWill,26,91,100,99,Free Delivery,Cash on Delivery Available,No
Women's & Girls' Fashion,https://www.daraz.com.bd/womens-bags/?&price=699-&service=OS&from=filter,LouisWill Women Cloud Bubble Shoulder Bag Soft Tote Bag Casual Book Bags Handbags Pleated Bubble High Capacity Shoulder Bag / Handbag,1139,750,34,LouisWill,6,91,100,99,Free Delivery,Cash on Delivery Available,No
Women's & Girls' Fashion,https://www.daraz.com.bd/womens-bags/?&price=699-&service=OS&from=filter,LouisWill Fashion Backpack Women Backpacks Waterproof Bag Oxford Daypack Shoulder Backpack Lightweight Handbag School Bag Backpack Casual Office Bag,2429,1500,38,LouisWill,57,91,100,99,Free Delivery,Cash on Delivery Available,No
Women's & Girls' Fashion,https://www.daraz.com.bd/womens-bags/?&price=699-&service=OS&from=filter,David Jones Paris women tote bag pu leather female crossbody bag large scarve lady handbag,3180,2010,37,David Jones,3,93,100,97,Standard Delivery,Cash on Delivery Available,No
Women's & Girls' Fashion,https://www.daraz.com.bd/womens-bags/?&price=699-&service=OS&from=filter,LouisWill Shoulder Bag Fashion Bucket Bag PU Crocodile Pattern Handbag Large Capacity Shoulder Bag Casual Messenger Bags Ladies Fashion Bag Simple Trend Multi-pocket Water Resistant Sling Bag For Women Ladies Female,2234,1390,38,LouisWill,24,91,100,99,Free Delivery,Cash on Delivery Available,No
Women's & Girls' Fashion,https://www.daraz.com.bd/womens-bags/?&price=699-&service=OS&from=filter,MATEYOYO Fashion Women Bag Vintage Handbags PU New Trendy Fashion Mini Bag Women's Chain Bag Shoulder Bag Women's round Crossbody Small Bag,3499,1700,51,MATEYOYO,90,92,100,100,Free Delivery,Cash on Delivery Available,No
Women's & Girls' Fashion,https://www.daraz.com.bd/womens-bags/?&price=699-&service=OS&from=filter,LouisWill Women Backpacks Anti-theft Shoulder Bags Korean Style Travel Bags School Bags Waterproof Oxford Daypacks Back Packs Lightweight Handbags with Free Ornament for Women,2489,1520,39,LouisWill,79,91,100,99,Free Delivery,Cash on Delivery Available,No
Women's & Girls' Fashion,https://www.daraz.com.bd/womens-bags/?&price=699-&service=OS&from=filter,David Jones Paris women shoulder bag pu leather female crossbody bag small lady handbag,7390,2100,72,David Jones,6,93,100,97,Standard Delivery,Cash on Delivery Available,No
Women's & Girls' Fashion,https://www.daraz.com.bd/womens-bags/?&price=699-&service=OS&from=filter,LouisWill Crossbody Bag Large Capacity Shoulder Bag Fashion Women Handbag Canvas Bag Sling Tote Beg Single Shoulder Bag Messenger Bag Cross Body Bag For School Travel Shopping,2199,1030,53,LouisWill,2,91,100,99,Free Delivery,Cash on Delivery Available,No
Women's & Girls' Fashion,https://www.daraz.com.bd/womens-bags/?&price=699-&service=OS&from=filter,IELGY women's niche bow crossbody small round bag,1980,1375,31,IELGY,3,84,100,100,Free Delivery,Cash on Delivery Available,No
Women's & Girls' Fashion,https://www.daraz.com.bd/womens-bags/?&price=699-&service=OS&from=filter,David Jones Paris women shoulder bag pu leather female crossbody bag small scarve lady shoulder bag,5150,2100,59,David Jones,9,93,100,97,Standard Delivery,Cash on Delivery Available,No
Women's & Girls' Fashion,https://www.daraz.com.bd/womens-bags/?&price=699-&service=OS&from=filter,Zip It Good 2022 new Women backpacks messenger bag hand-embroidered double back college style Oxford cloth backpack bags beg,1600,999,38,Zip It Good,2,84,0,69,Free Delivery,Cash on Delivery Available,Yes
Women's & Girls' Fashion,https://www.daraz.com.bd/womens-bags/?&price=699-&service=OS&from=filter,David Jones Paris women shoulder bag pu leather female crossbody bag small spring chain lady handbag,3440,1610,53,David Jones,31,93,100,97,Standard Delivery,Cash on Delivery Available,No
Women's & Girls' Fashion,https://www.daraz.com.bd/womens-bags/?&price=699-&service=OS&from=filter,LouisWill Women Bag Soft Leather Tassel Bag Single Shoulder Cross-body Bag Mother Bag Travel Bag Retro Cross-Body Bag Large Capacity Cross-body Bag Casual Messenger Bags For Female,2084,1350,35,LouisWill,31,91,100,99,Free Delivery,Cash on Delivery Available,No
Women's & Girls' Fashion,https://www.daraz.com.bd/womens-bags/?&price=699-&service=OS&from=filter,MATEYOYO Canvas Casual Handbag for Women,3099,1500,52,MATEYOYO,136,92,100,100,Free Delivery,Cash on Delivery Available,No
Women's & Girls' Fashion,https://www.daraz.com.bd/womens-bags/?&price=699-&service=OS&from=filter,LouisWill Men's Vintage Wallet PU Short Wallet Multi Card Zipper Wallet Business Wallets Coin Bag Zipper Clutch Wallets Multi-Card Position Wallets Wallet For Men Money Bag For Men,1109,700,37,LouisWill,4,91,100,99,Free Delivery,Cash on Delivery Available,No
Women's & Girls' Fashion,https://www.daraz.com.bd/womens-bags/?&price=699-&service=OS&from=filter,Women's Mateyoyo Shoulder Bag Soft PU Handbag Retro Crossbody Bag Large Capacity Crossbody Bag Casual Messenger Bag Magnetic Buckle Bag,4119,1910,54,MATEYOYO,88,92,100,100,Free Delivery,Cash on Delivery Available,No
Women's & Girls' Fashion,https://www.daraz.com.bd/womens-bags/?&price=699-&service=OS&from=filter,LouisWill Shoulder Bags school bag for Women,2399,1530,36,LouisWill,159,91,100,99,Free Delivery,Cash on Delivery Available,No
Women's & Girls' Fashion,https://www.daraz.com.bd/womens-bags/?&price=699-&service=OS&from=filter,LouisWill Women Shoulder Bags Cross Body Bags Korean Style Ladies Phone Pouch Casual Crossbody Mobile Phone Wallets Mini Fashion Shoulder Bag Water Resistant Sling Bag,1994,1270,36,LouisWill,23,91,100,99,Free Delivery,Cash on Delivery Available,No
Women's & Girls' Fashion,https://www.daraz.com.bd/womens-bags/?&price=699-&service=OS&from=filter,Travel Bag Waterproof Weekender Bags Oxford Cloth Luggages Handbag Shoulder Traveling Dry and Wet Separation Sport Bag Fitness Bag Gym Totes for Men 0r Women Large size( maroon / navy / Black),1400,1066,24,MY SHOPEE BD,2,86,0,99,Free Delivery,Cash on Delivery Available,Yes
Women's & Girls' Fashion,https://www.daraz.com.bd/womens-bags/?&price=699-&service=OS&from=filter,LouisWill Fashion Women Bag Crossbody Bag Underarm Bag Dumpling Bag Soft Shoulder Bag Handbag Fashion Sling Bag Large-capacity Messenger Bag Casual Shoulder Bag Down Shoulder Bags,1689,1060,37,LouisWill,1,91,100,99,Free Delivery,Cash on Delivery Available,No
Women's & Girls' Fashion,https://www.daraz.com.bd/womens-bags/?&price=699-&service=OS&from=filter,LouisWill Women Shoulder Bag Ladies Fashion Handbags Crossbody Bags Soft PU Bag Leisure Sling Bag Casual Messenger Bags Waterproof Travel Bags Multi Pocket Handbag,2024,1290,36,LouisWill,1,91,100,99,Free Delivery,Cash on Delivery Available,No
Women's & Girls' Fashion,https://www.daraz.com.bd/womens-bags/?&price=699-&service=OS&from=filter,IELGY Mid-length Slim A-line Trendy Women's skirt High waist Fashion Half-length Versatile Simple,2410,1580,34,IELGY,7,84,100,100,Free Delivery,Cash on Delivery Available,No
Women's & Girls' Fashion,https://www.daraz.com.bd/womens-bags/?&price=699-&service=OS&from=filter,ELEGANT MART double strap china fashion crossbody shoulder unique bag for girls,1800,1550,14,ELEGANT MART LIMITED,2,78,0,97,Free Delivery,Cash on Delivery Available,Yes
Women's & Girls' Fashion,https://www.daraz.com.bd/womens-bags/?&price=699-&service=OS&from=filter,Crossbody Bag Anti-Deformation Smooth Women Crossbody Bag,1400,792,43,Sunnyheart,7,82,100,100,Free Delivery,Cash on Delivery Available,No
Women's & Girls' Fashion,https://www.daraz.com.bd/womens-bags/?&price=699-&service=OS&from=filter,LouisWill Women's Shoulder Bag Fashion Woman’s Sling Bag Shoulder Bag Women Cross Body Bags Shoulder Bags PU Leather Large Capacity Shoulder Bag Embroidered Shoulder Bag Portable Crossbody Bag,2199,1420,35,LouisWill,3,91,100,99,Free Delivery,Cash on Delivery Available,No
Women's & Girls' Fashion,https://www.daraz.com.bd/womens-bags/?&price=699-&service=OS&from=filter,Printed Cross Body & Shoulder Handbag - MKPT01 (Chocolate),1890,790,58,ETCT,0,88,0,99,Free Delivery,Cash on Delivery Available,Yes
Women's & Girls' Fashion,https://www.daraz.com.bd/womens-bags/?&price=699-&service=OS&from=filter,Elegant korean trendy fashion backpack university western backpack for girls,1500,1048,30,ELEGANT MART LIMITED,0,78,0,97,Free Delivery,Cash on Delivery Available,Yes
Women's & Girls' Fashion,https://www.daraz.com.bd/womens-bags/?&price=699-&service=OS&from=filter,LouisWill Women Fashion Bag Cross Body Bags Shoulder Bags Korean Style Ladies Phone Pouch Casual Crossbody Mobile Phone Bag Fashion Shoulder Bag Water Resistant Sling Bag,2144,1340,38,LouisWill,2,91,100,99,Free Delivery,Cash on Delivery Available,No
Women's & Girls' Fashion,https://www.daraz.com.bd/womens-bags/?&price=699-&service=OS&from=filter,ELEGANT MART ladies handbags elegant fashion crossbody shoulder bags new trendy square bags for girls,1500,1081,28,ELEGANT MART LIMITED,2,78,0,97,Free Delivery,Cash on Delivery Available,Yes
Women's & Girls' Fashion,https://www.daraz.com.bd/womens-bags/?&price=699-&service=OS&from=filter,LouisWill Women Bag Ladies Fashion Bag Crossbody Bag Soft PU Shoulder Bag Underarm Bag Women Leather Chain Handbag Waterproof Sling Bag Female Elegant Bag,2439,1520,38,LouisWill,2,91,100,99,Free Delivery,Cash on Delivery Available,No
Women's & Girls' Fashion,https://www.daraz.com.bd/womens-bags/?&price=699-&service=OS&from=filter,ELEGANT MART Backpack Women Korean Version Tide Bag Lady Fashion Oxford Mini Travel Backpack,1250,999,20,ELEGANT MART LIMITED,4,78,0,97,Free Delivery,Cash on Delivery Available,Yes
Women's & Girls' Fashion,https://www.daraz.com.bd/womens-bags/?&price=699-&service=OS&from=filter,Elegant Women's Backpack New Korean Style Nylon Backpack Women's Fashion Splicing Women's Bag Travel Backpack,1500,899,40,ELEGANT MART LIMITED,4,78,0,97,Free Delivery,Cash on Delivery Available,Yes
Women's & Girls' Fashion,https://www.daraz.com.bd/womens-bags/?&price=699-&service=OS&from=filter,David Jones Paris Women Tote Bag Pu Leather Female Crossbody Bag Large Lady Shoulder Bag,7390,3300,55,David Jones,49,93,100,97,Standard Delivery,Cash on Delivery Available,No
Women's & Girls' Fashion,https://www.daraz.com.bd/womens-bags/?&price=699-&service=OS&from=filter,MATEYOYO 2 IN 1 Sling Bag Set Women Shoulder Bag Fashion Slung Bag Travel Bags Fashion Women Cross body Bag Leisure Style Suitable for Women Beach Bag Canvas Bag,3639,1500,59,MATEYOYO,89,92,100,100,Free Delivery,Cash on Delivery Available,No
Women's & Girls' Fashion,https://www.daraz.com.bd/womens-bags/?&price=699-&service=OS&from=filter,MATEYOYO Women Shoulder Bags Long Clutches Cross Body Bags Korean Style Ladies Phone Pouch Casual Crossbody Mobile Phone Wallets Mini Fashion Shoulder Bag Water Resistant Sling Bag,2069,1100,47,MATEYOYO,131,92,100,100,Free Delivery,Cash on Delivery Available,No
Women's & Girls' Fashion,https://www.daraz.com.bd/womens-bags/?&price=699-&service=OS&from=filter,David Jones Paris sling bag for women leather crossbody bag messenger bags ladies shoulder bag woman handbag 2022,7390,3220,56,David Jones,12,93,100,97,Standard Delivery,Cash on Delivery Available,No
Women's & Girls' Fashion,https://www.daraz.com.bd/womens-bags/?&price=699-&service=OS&from=filter,Prive Roma LADIES WALLET,1299,974,25,Bata,4,84,0,98,Free Delivery,Cash on Delivery Available,Yes
