Category,SubCategory,Title,Original Price,Discount Price,Discount,Seller Name,Number of Ratings,Positive Seller Ratings,Ship On Time,Chat Response Rate,Delivery Type,Cash On Delivery,Flagship Store
Women's & Girls' Fashion,https://www.daraz.com.bd/womens-abayas-and-hijabs/?price=200-&from=filter,abaya borka Mohua gown-5 With Niqab Hijab Dubai Cherry stylish party borka hijab fashion collection Fashionable khimar Lycra borka for Women,2500,1823,27,HAMIM FASHION,5,87,0,100,Free Delivery,Cash on Delivery Available,Yes
Women's & Girls' Fashion,https://www.daraz.com.bd/womens-abayas-and-hijabs/?price=200-&from=filter,Regular Use Pocket Borka For Women Comfortable & Stylish Women Islamic Outerwear Abaya Borkha - Borka For Women - Contains enduring appeal and value,1550,823,47,Step On,108,84,0,100,Free Delivery,Cash on Delivery Available,No
Women's & Girls' Fashion,https://www.daraz.com.bd/womens-abayas-and-hijabs/?price=200-&from=filter,Niqab Khimar for muslim womens Best khimar with niqab Best hiab-orna-khimar Linen century fabric,1150,649,44,Ahnaf Hizab House,4,0,0,100,Standard Delivery,Cash on Delivery Available,No
Women's & Girls' Fashion,https://www.daraz.com.bd/womens-abayas-and-hijabs/?price=200-&from=filter,most demanding elegant design premium quality lace net gown for women,1290,770,40,R K creative fashion,4,81,0,100,Standard Delivery,Cash on Delivery Available,No
Women's & Girls' Fashion,https://www.daraz.com.bd/womens-abayas-and-hijabs/?price=200-&from=filter,"New Attractive High-Quality Mohuya 4 Borkha Set, Dubai Charry Fabric Abaya Burqa, For Muslim Women",2250,1197,47,Welcome 2 Best Fashion House,4,81,0,100,Standard Delivery,Cash on Delivery Available,No
Women's & Girls' Fashion,https://www.daraz.com.bd/womens-abayas-and-hijabs/?price=200-&from=filter,"Indispensable -Quality And Durablity -Leona Living Instant ready hijab with Niqab for women,- Innovative Preferble - Low Hassle and Maintanance",369,229,38,As-Sunnah Collection,12,71,0,100,Standard Delivery,Cash on Delivery Available,No
Women's & Girls' Fashion,https://www.daraz.com.bd/womens-abayas-and-hijabs/?price=200-&from=filter,KIDS HIJAB COLLECTION / SCHOOL HIJAB FOR BABY/ FOR 1 TO 11 YEARS BABY / LINEN CLOTH .,900,399,56,FEBO COLOUR,13,89,0,100,Free Delivery,Cash on Delivery Available,No
Women's & Girls' Fashion,https://www.daraz.com.bd/womens-abayas-and-hijabs/?price=200-&from=filter,"Olive Colour Hijab For Nurses, Instant Ready Hijab For Women 2022 - Niqab",390,282,28,Bponi,17,91,0,96,Free Delivery,Cash on Delivery Available,No
Women's & Girls' Fashion,https://www.daraz.com.bd/womens-abayas-and-hijabs/?price=200-&from=filter,Crown Hijab 2 Part Instant Ready Hijab with Niqab for Woman - Hijab Collection - Hijab - Niqab,473,334,29,Hijab WaaLi,267,91,0,98,Free Delivery,Cash on Delivery Available,No
Women's & Girls' Fashion,https://www.daraz.com.bd/womens-abayas-and-hijabs/?price=200-&from=filter,Regular Outerwear Abaya Borka For Women Full Body Kuchi Design Outfit Pocket Borkha Abaya - Borka For Women,1300,827,36,Step On,20,84,0,100,Free Delivery,Cash on Delivery Available,No
Women's & Girls' Fashion,https://www.daraz.com.bd/womens-abayas-and-hijabs/?price=200-&from=filter,Dubai Cherry Full Set 4 Part Borka For Women Shukriya Closet by Shukriya Fashion,2450,1222,50,Shukriya Fashion,11,80,0,97,Free Delivery,Cash on Delivery Available,No
Women's & Girls' Fashion,https://www.daraz.com.bd/womens-abayas-and-hijabs/?price=200-&from=filter,Irani Kuchi Borka For Muslim Women Outwear Shukriya Closet,1800,1046,42,Shukriya Closet,9,81,0,93,Free Delivery,Cash on Delivery Available,No
Women's & Girls' Fashion,https://www.daraz.com.bd/womens-abayas-and-hijabs/?price=200-&from=filter,Crown Hijab 2 Part Instant Ready Hijab with Niqab for Woman - Hijab alexx,550,252,54,ShafiQ Fashion B D,16,80,0,95,Free Delivery,Cash on Delivery Available,No
Women's & Girls' Fashion,https://www.daraz.com.bd/womens-abayas-and-hijabs/?price=200-&from=filter,Instant Ready Hijab With Niqab For Woman,499,309,38,As-Sunnah Collection,13,71,0,100,Standard Delivery,Cash on Delivery Available,No
Women's & Girls' Fashion,https://www.daraz.com.bd/womens-abayas-and-hijabs/?price=200-&from=filter,Abaya Borkha Lace Gown-2 With+Hijab Dubai Cherry Stylish Party Fashionable Lycra Muslim Wear for Women,1800,1221,32,HAMIM FASHION,11,87,0,100,Free Delivery,Cash on Delivery Available,Yes
Women's & Girls' Fashion,https://www.daraz.com.bd/womens-abayas-and-hijabs/?price=200-&from=filter,Medina Bawal Instant Ready Hijab by Hijab WaaLi,550,339,38,Hijab WaaLi,124,91,0,98,Free Delivery,Cash on Delivery Available,No
Women's & Girls' Fashion,https://www.daraz.com.bd/womens-abayas-and-hijabs/?price=200-&from=filter,Eagle Niqab 1 part Premium Quality Arabian Eagle Nikab for women Lebas E Tayibah,380,288,24,Lebas-E Tayibah,7,91,0,100,Free Delivery,Cash on Delivery Available,No
Women's & Girls' Fashion,https://www.daraz.com.bd/womens-abayas-and-hijabs/?price=200-&from=filter,Hijab Instant Bergo Veil French Khimar Aminah Rope Veil Niqab Syair Standard From Intimate Shop (Custom Color Req Available) - Hijab Collection,499,298,40,Intimate Shop,63,92,0,0,Standard Delivery,Cash on Delivery Available,No
Women's & Girls' Fashion,https://www.daraz.com.bd/womens-abayas-and-hijabs/?price=200-&from=filter,Abaya Borka new collection irani stylish fashionable collection Borka for women,1150,546,53,Nishi Online Mart,20,0,0,100,Standard Delivery,Cash on Delivery Available,No
Women's & Girls' Fashion,https://www.daraz.com.bd/womens-abayas-and-hijabs/?price=200-&from=filter,Solid Chiffon Headscarf Ready To Wear Instant Hijab Scarf - Hijab Collection,450,346,23,HAMIM FASHION,423,87,0,100,Free Delivery,Cash on Delivery Available,Yes
Women's & Girls' Fashion,https://www.daraz.com.bd/womens-abayas-and-hijabs/?price=200-&from=filter,Hoodie niqab butterfly hooded niqab for full body cover hijab for prayer,384,352,8,AL RIYAD ENTERPRISE,292,90,0,99,Free Delivery,Cash on Delivery Available,Yes
Women's & Girls' Fashion,https://www.daraz.com.bd/womens-abayas-and-hijabs/?price=200-&from=filter,Rani gown borka dubai charry georgette kapor without hijab for Muslim women,1390,960,31,Ehan Online Shop BD,6,81,0,94,Standard Delivery,Cash on Delivery Available,No
Women's & Girls' Fashion,https://www.daraz.com.bd/womens-abayas-and-hijabs/?price=200-&from=filter,Rangdonu Step Borka Dubai Chari Garget Kapoor - A Must-Have for Stylish Muslim Women - Elevate Modesty with Elegance,1350,876,35,Ehan Online Shop BD,14,81,0,94,Standard Delivery,Cash on Delivery Available,No
Women's & Girls' Fashion,https://www.daraz.com.bd/womens-abayas-and-hijabs/?price=200-&from=filter,"Hijab for my princess's, kid's hijab collection / starting from 1 years/ linen cloth. - Hijab Collection",1000,244,76,Pp Shop (MYM),4,92,0,91,Standard Delivery,Cash on Delivery Available,No
Women's & Girls' Fashion,https://www.daraz.com.bd/womens-abayas-and-hijabs/?price=200-&from=filter,Premium Cherry Georgette Hijab For Women Full Coverage Hijabs Hijab Collection,480,279,42,Home Edge,86,90,0,96,Free Delivery,Cash on Delivery Available,No
Women's & Girls' Fashion,https://www.daraz.com.bd/womens-abayas-and-hijabs/?price=200-&from=filter,Stylish Dubai Cherry Georgette Borka For Women - Borka For Women,1250,845,32,Najat Fashion,2,84,0,79,Free Delivery,Cash on Delivery Available,No
Women's & Girls' Fashion,https://www.daraz.com.bd/womens-abayas-and-hijabs/?price=200-&from=filter,"1 Piece Dubai Cherry Hijab Fashionable Soft & Premium Quality 80""/30"" - Hijab Collection",500,319,36,Collection's Of Kanij,13,87,0,88,Free Delivery,Cash on Delivery Available,No
Women's & Girls' Fashion,https://www.daraz.com.bd/womens-abayas-and-hijabs/?price=200-&from=filter,New Collection Embroidery Work Outerwear Borkha For Women Without Hijab Fashionable Out-fit Borka Black Color,1950,954,51,Home Edge,15,90,0,96,Free Delivery,Cash on Delivery Available,No
Women's & Girls' Fashion,https://www.daraz.com.bd/womens-abayas-and-hijabs/?price=200-&from=filter,Exclusive Collection Dubai Cherry Fabric anzar Borka - Elevate Your Style with this Unique Design - Easy to maintain,1190,978,18,R K creative fashion,35,81,0,100,Standard Delivery,Cash on Delivery Available,No
Women's & Girls' Fashion,https://www.daraz.com.bd/womens-abayas-and-hijabs/?price=200-&from=filter,"Glam Touch Premium Manha Solid Abaya, Boroka for Women, Dubai Cherry Abaya",2200,1450,34,Glam Touch,54,93,0,97,Free Delivery,Cash on Delivery Available,Yes
Women's & Girls' Fashion,https://www.daraz.com.bd/womens-abayas-and-hijabs/?price=200-&from=filter,Glam Touch - Premium Quality (80X30) Full Coverage Diamond Georgette Plain Hijab Combo Set,2250,1600,29,Glam Touch,83,93,0,97,Free Delivery,Cash on Delivery Available,Yes
Women's & Girls' Fashion,https://www.daraz.com.bd/womens-abayas-and-hijabs/?price=200-&from=filter,Jorjet Shahjadi Gown Borkha Georgette Abaya New Cherry Borka . by Shukriya Fashion,1450,854,41,Shukriya Fashion,2,80,0,97,Free Delivery,Cash on Delivery Available,No
Women's & Girls' Fashion,https://www.daraz.com.bd/womens-abayas-and-hijabs/?price=200-&from=filter,New Net Pal Gown Abaya Borka-(Hijab + Nikab + Inner + Koti + Belt) - Party Borka Hijab Fashion Collection with Fashionable Khimar Lycra Borka,2850,1665,42,Shukriya Closet,8,81,0,93,Free Delivery,Cash on Delivery Available,No
Women's & Girls' Fashion,https://www.daraz.com.bd/womens-abayas-and-hijabs/?price=200-&from=filter,Abaya party stone borka with hijab dubai charry jorjet kapor for muslim woman,3250,1849,43,Ehan Online Shop BD,7,81,0,94,Standard Delivery,Cash on Delivery Available,No
Women's & Girls' Fashion,https://www.daraz.com.bd/womens-abayas-and-hijabs/?price=200-&from=filter,Beautiful collection butterfly borka/ 3 part hijab niqab Borka for women,2190,1290,41,RK Creative Shop,17,81,0,100,Standard Delivery,Cash on Delivery Available,No
Women's & Girls' Fashion,https://www.daraz.com.bd/womens-abayas-and-hijabs/?price=200-&from=filter,Hijab/My Hijab/School Hijab/Baby Girl Hijab/Muslim Baby Girl Hijab - Hijab Collection - Hijab Collection - Niqab,600,325,46,MA Enterprise limited 1624333742,5,91,0,100,Free Delivery,Cash on Delivery Available,No
Women's & Girls' Fashion,https://www.daraz.com.bd/womens-abayas-and-hijabs/?price=200-&from=filter,Three part hoodie niqab full coverage hoodie niqab jorjet niqab niqab for prayer,750,738,2,AL RIYAD ENTERPRISE,3,90,0,99,Free Delivery,Cash on Delivery Available,Yes
Women's & Girls' Fashion,https://www.daraz.com.bd/womens-abayas-and-hijabs/?price=200-&from=filter,Instant Ready Hijab Collection By Unique Items - Hijab Collection - Hijab Collection - Niqab,391,254,35,Bponi,41,91,0,96,Free Delivery,Cash on Delivery Available,No
Women's & Girls' Fashion,https://www.daraz.com.bd/womens-abayas-and-hijabs/?price=200-&from=filter,"New Attractive High-Quality Step Contrast Irani Party Abaya Burkha Set, Dubai Charry Fabric, Muslim Outerwear",2150,1113,48,AMR Online Shop,12,87,0,100,Free Delivery,Cash on Delivery Available,No
Women's & Girls' Fashion,https://www.daraz.com.bd/womens-abayas-and-hijabs/?price=200-&from=filter,Abaya Borka Mohua Gown with Hoodie Niqab Hijab Dubai Cherry Stylish Party Borka Hijab Fashion Collection Fashionable Khimar Lycra Borkha for Women,2250,1437,36,HAMIM FASHION,38,87,0,100,Free Delivery,Cash on Delivery Available,Yes
Women's & Girls' Fashion,https://www.daraz.com.bd/womens-clothing/?service=OS,Warm And Weightless High Neck Sweater For Women,750,158,79,Fashion Park,28,92,0,96,Standard Delivery,Cash on Delivery Available,Yes
Women's & Girls' Fashion,https://www.daraz.com.bd/womens-clothing/?service=OS,Stylish lady's hoodie,1050,515,51,Tazim Fashion,5,82,0,97,Free Delivery,Cash on Delivery Available,Yes
Women's & Girls' Fashion,https://www.daraz.com.bd/womens-clothing/?service=OS,Women's Classic Mid Length Long Sleeve Open Front Cardigan Sweater Shrug For Ladies From Levin,450,432,4,Levin Mall,24,90,0,97,Free Delivery,Cash on Delivery Available,Yes
Women's & Girls' Fashion,https://www.daraz.com.bd/womens-clothing/?service=OS,Relaxed 1UP Jumper for Women - Multicolor,1000,590,41,Scatman Fashion,2,89,100,96,Standard Delivery,Cash on Delivery Available,No
Women's & Girls' Fashion,https://www.daraz.com.bd/womens-clothing/?service=OS,Women's Mock neck Half Sleeve Knitted Sweater Jumper For Ladies From Levin,600,459,24,Levin Mall,11,90,0,97,Free Delivery,Cash on Delivery Available,Yes
Women's & Girls' Fashion,https://www.daraz.com.bd/womens-clothing/?service=OS,Warm And Weightless High Neck Sweater For Women,750,194,74,Fashion Park,2,92,0,96,Standard Delivery,Cash on Delivery Available,Yes
Women's & Girls' Fashion,https://www.daraz.com.bd/womens-clothing/?service=OS,Warm And Weightless High Neck Sweater For Women,750,240,68,Fashion Park,9,92,0,96,Standard Delivery,Cash on Delivery Available,Yes
Women's & Girls' Fashion,https://www.daraz.com.bd/womens-clothing/?service=OS,Warm And Weightless High Neck Sweater For Women,750,250,67,Fashion Park,9,92,0,96,Standard Delivery,Cash on Delivery Available,Yes
Women's & Girls' Fashion,https://www.daraz.com.bd/womens-clothing/?service=OS,Ladies Long Sleeve V Neck Front Pocket Rib Sweater Jumper,500,460,8,Levin Mall,14,90,0,97,Free Delivery,Cash on Delivery Available,Yes
Women's & Girls' Fashion,https://www.daraz.com.bd/womens-clothing/?service=OS,Lds Knitwear Relaxed Cable Jumper for Women - Light Pink,1000,570,43,Scatman Fashion,0,89,100,96,Standard Delivery,Cash on Delivery Available,No
Women's & Girls' Fashion,https://www.daraz.com.bd/womens-clothing/?service=OS,Women Side Slit Long Sleeve Mock Neck Knitted Long Sweater Dress From Levin,699,569,19,Levin Mall,4,90,0,97,Free Delivery,Cash on Delivery Available,Yes
Women's & Girls' Fashion,https://www.daraz.com.bd/womens-clothing/?service=OS,Women's Knitted Long Sleeve V Neck Sweater Pullover Tops Jumpers For Ladies From Levin,400,380,5,Levin Mall,11,90,0,97,Free Delivery,Cash on Delivery Available,Yes
Women's & Girls' Fashion,https://www.daraz.com.bd/womens-clothing/?service=OS,Womens V Neck Long Sleeve Metallic Shimmer Knitted Tops Jumper Sweater For Ladies From Levin,600,490,18,Levin Mall,11,90,0,97,Free Delivery,Cash on Delivery Available,Yes
Women's & Girls' Fashion,https://www.daraz.com.bd/womens-clothing/?service=OS,Lds Knitwear Chunky Cardigan - Black,990,565,43,Scatman Fashion,0,89,100,96,Standard Delivery,Cash on Delivery Available,No
Women's & Girls' Fashion,https://www.daraz.com.bd/womens-clothing/?service=OS,Hiba Light Olive Double Georgette Fabric Shrug Women 0823 000230,1550,1163,25,Showstopper,1,90,0,97,Free Delivery,Cash on Delivery Available,Yes
Women's & Girls' Fashion,https://www.daraz.com.bd/womens-clothing/?service=OS,Rigo Women Peach Heart Print Peasant Sleeve Fleece Sweatshirt,1117,889,20,RIGO,0,0,100,64,Standard Delivery,Cash on Delivery Available,No
Women's & Girls' Fashion,https://www.daraz.com.bd/womens-clothing/?service=OS,Jacket Digital Print Loose-fitting Round Neck Coat,3528,2117,40,Sunnyheart,0,82,100,100,Free Delivery,Cash on Delivery Available,No
Women's & Girls' Fashion,https://www.daraz.com.bd/womens-clothing/?service=OS,Stylish lady's hoodie,1050,515,51,Tazim Fashion,0,82,0,97,Free Delivery,Cash on Delivery Available,Yes
Women's & Girls' Fashion,https://www.daraz.com.bd/womens-clothing/?service=OS,Women Sweater Coat Long Sleeve Split Pure Color Sweater Coat,6328,3797,40,Sunnyheart,1,82,100,100,Free Delivery,Cash on Delivery Available,No
Women's & Girls' Fashion,https://www.daraz.com.bd/womens-clothing/?service=OS,Lds Knitwear Relaxed Textured Rib Knit Jumper for Women - Yellow,990,570,42,Scatman Fashion,0,89,100,96,Standard Delivery,Cash on Delivery Available,No
Women's & Girls' Fashion,https://www.daraz.com.bd/womens-clothing/?service=OS,Lds Knitwear Relaxed Fashion love fur Sweater for Women - Green,1000,560,44,Scatman Fashion,0,89,100,96,Standard Delivery,Cash on Delivery Available,No
Women's & Girls' Fashion,https://www.daraz.com.bd/womens-clothing/?service=OS,Women's Lightweight Long Sleeve Open Front Pocket Long Cardigan Shrug From Levin,650,569,12,Levin Mall,2,90,0,97,Free Delivery,Cash on Delivery Available,Yes
Women's & Girls' Fashion,https://www.daraz.com.bd/womens-clothing/?service=OS,IELGY Coats Casual Knitted Sweater for Women,2540,1752,31,IELGY,15,84,100,100,Free Delivery,Cash on Delivery Available,No
Women's & Girls' Fashion,https://www.daraz.com.bd/womens-clothing/?service=OS,"Glam Touch Premium Quality Designer Cape and Skirt Set for Women, Party Kaftan",2240,1610,28,Glam Touch,19,93,0,98,Free Delivery,Cash on Delivery Available,Yes
Women's & Girls' Fashion,https://www.daraz.com.bd/womens-clothing/?service=OS,Womens Knitted Long Sleeve Striped Crew Neck Sweater Pullover Tops Jumpers For Ladies From Levin,550,449,18,Levin Mall,8,90,0,97,Free Delivery,Cash on Delivery Available,Yes
Women's & Girls' Fashion,https://www.daraz.com.bd/womens-clothing/?service=OS,Hiba Light Mauve Double Georgette Fabric Shrug Women 0823 000232,1550,1163,25,Showstopper,1,90,0,97,Free Delivery,Cash on Delivery Available,Yes
Women's & Girls' Fashion,https://www.daraz.com.bd/womens-clothing/?service=OS,Nipun Crafts Ltd Maroone Linen All Over Screen Print With Hand Embrodary Show Batton Ladies Kuptan For Womens,1450,1450,0,Nipun Crafts Ltd,0,0,100,0,Standard Delivery,Cash on Delivery Available,Yes
Women's & Girls' Fashion,https://www.daraz.com.bd/womens-clothing/?service=OS,IELGY Sweaters women's loose design patchwork denim jacket,3230,2129,34,IELGY,0,84,100,100,Free Delivery,Cash on Delivery Available,No
Women's & Girls' Fashion,https://www.daraz.com.bd/womens-clothing/?service=OS,Sunnyheart Summer Breach Coat Sun-screen Anti-UV Sun Protection Summer Breach Coat,2512,1759,30,Sunnyheart,0,82,100,100,Free Delivery,Cash on Delivery Available,No
Women's & Girls' Fashion,https://www.daraz.com.bd/womens-clothing/?service=OS,Lady Coat Long Sleeve Big Pockets Women Jacket,3111,2178,30,Sunnyheart,0,82,100,100,Free Delivery,Cash on Delivery Available,No
Women's & Girls' Fashion,https://www.daraz.com.bd/womens-clothing/?service=OS,WOMEN' SWEATER REGULAR FIT GOLDEN WSW014,1880,1128,40,SOLASTA,0,82,100,0,Free Delivery,Cash on Delivery Available,Yes
Women's & Girls' Fashion,https://www.daraz.com.bd/womens-clothing/?service=OS,Knitted Sweater All-Match V-Neck Loose Warm Pullover Sweater,2871,2010,30,Sunnyheart,0,82,100,100,Free Delivery,Cash on Delivery Available,No
Women's & Girls' Fashion,https://www.daraz.com.bd/womens-clothing/?service=OS,Sweater Jumpers Regular Sleeve Contrast Color Loose Sweater,4878,3415,30,Sunnyheart,0,82,100,100,Free Delivery,Cash on Delivery Available,No
Women's & Girls' Fashion,https://www.daraz.com.bd/womens-clothing/?service=OS,Sweater Top Stretchy Solid Color Pullover Knitted Sweater,4316,2272,47,Sunnyheart,0,82,100,100,Free Delivery,Cash on Delivery Available,No
Women's & Girls' Fashion,https://www.daraz.com.bd/womens-clothing/?service=OS,Women Sweater Skin Affinity INS Knitted Autumn Winter Sweater,3865,2319,40,Sunnyheart,0,82,100,100,Free Delivery,Cash on Delivery Available,No
Women's & Girls' Fashion,https://www.daraz.com.bd/womens-clothing/?service=OS,Knitted Sweater Long Sleeve Stripes Patchwork Warm Sweater Jumper,3751,2626,30,Sunnyheart,0,82,100,100,Free Delivery,Cash on Delivery Available,No
Women's & Girls' Fashion,https://www.daraz.com.bd/womens-clothing/?service=OS,Women Sweater All Match Stylish Keep Warm Sweater,3615,2169,40,Sunnyheart,0,82,100,100,Free Delivery,Cash on Delivery Available,No
Women's & Girls' Fashion,https://www.daraz.com.bd/womens-clothing/?service=OS,Sunnyheart Long Sleeve V-neck Cotton Long Sleeve Sweater,3604,2523,30,Sunnyheart,0,82,100,100,Free Delivery,Cash on Delivery Available,No
Women's & Girls' Fashion,https://www.daraz.com.bd/womens-clothing/?service=OS,Sunnyheart Cardigan Sweater V-Neck Loose Striped Contrast Color Sweater Cardigan,6771,4740,30,Sunnyheart,0,82,100,100,Free Delivery,Cash on Delivery Available,No
Women's & Girls' Fashion,https://www.daraz.com.bd/womens-clothing/?service=OS,IELGY women's ice silk loose long sleeve sun protection two-piece,2940,1625,45,IELGY,0,84,100,100,Free Delivery,Cash on Delivery Available,No
Women's & Girls' Fashion,https://www.daraz.com.bd/womens-clothing/?service=OS,Pullover Sweater Long Sleeve Patchwork Color Knitted Pullover,3931,2752,30,Sunnyheart,0,82,100,100,Free Delivery,Cash on Delivery Available,No
Women's & Girls' Fashion,https://www.daraz.com.bd/womens-clothing/?service=OS,Sweater Jumper Beading Collar Classic Basic Type Sweater,3305,2314,30,Sunnyheart,0,82,100,100,Free Delivery,Cash on Delivery Available,No
Women's & Girls' Fashion,https://www.daraz.com.bd/womens-clothing/?service=OS,Sweater Round Neck Warm Pure Color Sweater,3953,2372,40,Sunnyheart,0,82,100,100,Free Delivery,Cash on Delivery Available,No
Women's & Girls' Fashion,https://www.daraz.com.bd/womens-clothing/?service=OS,Knitted Sweater Crew Neck Loose Warm Women Casual Sweater,3118,2183,30,Sunnyheart,0,82,100,100,Free Delivery,Cash on Delivery Available,No
Women's & Girls' Fashion,https://www.daraz.com.bd/womens-clothing/?service=OS,Xmas Sweater Stretchy Xmas Turtleneck Couple Outfit Sweater,4412,3089,30,Sunnyheart,0,82,100,100,Free Delivery,Cash on Delivery Available,No
Women's & Girls' Fashion,https://www.daraz.com.bd/womens-clothing/?service=OS,Pullover Sweater Fine Workmanship Loose Warm Women Casual Sweater,3030,2121,30,Sunnyheart,0,82,100,100,Free Delivery,Cash on Delivery Available,No
Women's & Girls' Fashion,https://www.daraz.com.bd/womens-clothing/?service=OS,Women Cardigan Anti-shrink Lady Knitted Sweater Coat,4011,2808,30,Sunnyheart,0,82,100,100,Free Delivery,Cash on Delivery Available,No
Women's & Girls' Fashion,https://www.daraz.com.bd/womens-clothing/?service=OS,Women Sweater V Neck Loose-fitting Contrast Color Pullover,4025,2415,40,Sunnyheart,0,82,100,100,Free Delivery,Cash on Delivery Available,No
Women's & Girls' Fashion,https://www.daraz.com.bd/womens-clothing/?service=OS,Sweater Cardigan Loose Thick Buttons Long Sweater Cardigan,5815,3489,40,Sunnyheart,0,82,100,100,Free Delivery,Cash on Delivery Available,No
Women's & Girls' Fashion,https://www.daraz.com.bd/womens-clothing/?service=OS,Knitted Sweater Round Neck Jacquard Warm Lady Knitted Sweater,3815,2671,30,Sunnyheart,0,82,100,100,Free Delivery,Cash on Delivery Available,No
Women's & Girls' Fashion,https://www.daraz.com.bd/womens-clothing/?service=OS,Women Knit Clothes Close-fitting Pullover Sweater Women Tops,3305,2314,30,Sunnyheart,0,82,100,100,Free Delivery,Cash on Delivery Available,No
Women's & Girls' Fashion,https://www.daraz.com.bd/womens-clothing/?service=OS,Lady Waistcoat Belt Side Split Sweater Waistcoat,2947,2063,30,Sunnyheart,0,82,100,100,Free Delivery,Cash on Delivery Available,No
Women's & Girls' Fashion,https://www.daraz.com.bd/womens-clothing/?service=OS,Sweater Coat Open Stitch Draped Big Pockets Lady Knitted Cardigan,3930,2751,30,Sunnyheart,0,82,100,100,Free Delivery,Cash on Delivery Available,No
Women's & Girls' Fashion,https://www.daraz.com.bd/womens-clothing/?service=OS,Sweater Cardigan Mid-Length Letters Print Hooded Women Cardigan,6720,4704,30,Sunnyheart,0,82,100,100,Free Delivery,Cash on Delivery Available,No
Women's & Girls' Fashion,https://www.daraz.com.bd/womens-clothing/?service=OS,Autumn Sweater Solid Color Sweet Women Sweater,2898,2029,30,Sunnyheart,0,82,100,100,Free Delivery,Cash on Delivery Available,No
Women's & Girls' Fashion,https://www.daraz.com.bd/womens-clothing/?service=OS,Pullover Sweater Stretchy Backless Short Women Knitwear Top,3338,2337,30,Sunnyheart,0,82,100,100,Free Delivery,Cash on Delivery Available,No
Women's & Girls' Fashion,https://www.daraz.com.bd/womens-clothing/?service=OS,Office Lady Sweater Hollow Out Elegant Loose Pullover Sweater,3247,2273,30,Sunnyheart,0,82,100,100,Free Delivery,Cash on Delivery Available,No
Women's & Girls' Fashion,https://www.daraz.com.bd/womens-clothing/?service=OS,Women Sweater Long Sleeve Snowflake Print Jacquard Xmas Sweater,3388,2372,30,Sunnyheart,0,82,100,100,Free Delivery,Cash on Delivery Available,No
Women's & Girls' Fashion,https://www.daraz.com.bd/womens-clothing/?service=OS,Autumn Sweater O Neck Contrast Colors Anti-shrink Spring Sweater,3611,2528,30,Sunnyheart,0,82,100,100,Free Delivery,Cash on Delivery Available,No
Women's & Girls' Fashion,https://www.daraz.com.bd/womens-clothing/?service=OS,Sunnyheart Lady Sweater Easy to Match Flower Applique Hollow Out Winter Sweater,4963,2978,40,Sunnyheart,0,82,100,100,Free Delivery,Cash on Delivery Available,No
Women's & Girls' Fashion,https://www.daraz.com.bd/womens-clothing/?service=OS,Women Sweater Contrast Colors Irregular Color-matching Fall Sweater,3208,2246,30,Sunnyheart,0,82,100,100,Free Delivery,Cash on Delivery Available,No
Women's & Girls' Fashion,https://www.daraz.com.bd/womens-clothing/?service=OS,Jumper Top Lantern Sleeve Comfy Turtleneck Pullover Women Sweater,3187,2231,30,Sunnyheart,0,82,100,100,Free Delivery,Cash on Delivery Available,No
Women's & Girls' Fashion,https://www.daraz.com.bd/womens-clothing/?service=OS,Cardigan Sweater Long Sleeve Women Large Buttons Decor Sweater,7068,4948,30,Sunnyheart,0,82,100,100,Free Delivery,Cash on Delivery Available,No
Women's & Girls' Fashion,https://www.daraz.com.bd/womens-clothing/?service=OS,Sunnyheart Sweater Top O-Neck Female Casual Hollow Out Crochet Knitted Sweater,4872,3411,30,Sunnyheart,0,82,100,100,Free Delivery,Cash on Delivery Available,No
Women's & Girls' Fashion,https://www.daraz.com.bd/womens-clothing/?service=OS,Lady Sweater Skin-friendly Korean Short Elegant Lady Sweater,3364,2355,30,Sunnyheart,0,82,100,100,Free Delivery,Cash on Delivery Available,No
Women's & Girls' Fashion,https://www.daraz.com.bd/womens-clothing/?service=OS,Lady Pullover Keep Warm Modern Design Knitted Pullover Sweater,3622,2536,30,Sunnyheart,0,82,100,100,Free Delivery,Cash on Delivery Available,No
